{
    "sha1": "6c97644ea50f922b8bb2671c772d006b2abf4c87",
    "created": 1563376076661,
    "sha224": "fc76d04a9c02b99e72fd0ec519c1a713ebf4d1ac451cf2542d6c1f9b",
    "filename": "sample_ioc.pdf",
    "sha256": "578711d047bbce6542b5c4f17224d2042ae4ae93a045e0a7b27765f7be226be2",
    "content_type": "application/pdf",
    "sha384": "e6b21c2c6a7bd3e0143bfb8d16e354ccbbbe39df6a586bf6d28443319b4e432816c7a931790f264ac167de6cfd53444e",
    "size": 123852,
    "sha512": "74150483cc49014ff7a83caa2afb71dad62fdb0ec567e4a34fd4fa87a1037b2c5373cc06df0c6ac18e6d399f5bf498e4643c216ad6c7d6b51ab1e506d6768b2a",
    "md5": "fd83928b1530399aa355301ccab3620c"
}