{
  "filename": "fn_timer.log",
  "content_type": "application/octet-stream",
  "size": 14094,
  "created": 1663093337313,
  "blake2b": "26c1297f39175f4b401ebf74e3e5ce49775ba7720f5cce375cabff28cd3b18511a8d9463c1c9f8c85a0cd6d9133b1e5d6486d1054946b2379e4dcafa1d91cc27",
  "md5": "d6815ac62179797d87d21b942ed7c96f",
  "shake_128": "8d64165fb1599e845faefe04040f8151589fec8fb13e09aeb6ea68e5f5b98ef5032e5233a6463785f1f613e8ba5b0fdb385754845c5f40b6d8f620496366d72709daca6b711ed9646f971e2ad76f78e83077bc8525e8b37610bc6584b96e89439672b093594b541a4c1a9b54bc9b5594d61aaaa3eee7435890cfa9035b820495",
  "shake_256": "356ba4b7bc9fda6ad64ed936f0d47e7b19022adfcfc236753182f13a82613c87e3b2dc206fb523952d1841837f785dd8bf137d74919253249327dec36a7b4f180a61cd29e2f2db53febac95deee3300519d4dd28ba08af297f29a5862653a314324e78e41fe2696ab25fb42aa80c63556eeb119d961157c0fb573d93953b7adc485e4cee5c3ecc5561acc5d45c2b1ccb5575a28763a877859d11c9f520d311a750314aebbd71e2459caa4d35a799aeee9f285934086f302d94f368ace46def566f6aac8884b5701914ff26f304b072931bbaeb697aa9d11a71d21767924c96ffe5793848aee50cf40d02dfe4f70f6d329cb83d380397f5f4081c1dcb39034458",
  "sha256": "561976be4b6e992478c13ea230e0f6a4e708e3b7befc61642dcd281bcacec975",
  "sha512": "f6f5835d41d48d27a1ed7101ae0e21dc3548aab452f5c5d9a634f68c09b50b3ec062f086296628f8d226566637887e5c7be815c83abe2dc8b2746e324b70ac5c",
  "sha3_224": "18f24955d1f242a59f550f52c7bc09d08e423552774674058511cefc",
  "sha384": "83a8bc932fc27c3e8f7c064a809c23aa8d737d2e1844b3c512e912fef14678f43bb0c994250a1d628b06b88075f2b441",
  "blake2s": "9ee3fa9f9907f3c6321a7323aaf0bee5a4aa5eb59652911d3cde20567d90f75e",
  "sha3_256": "756508e728338b4931e199674e65ff9ba5daa25914f75cca8d424efd7ab89f0d",
  "sha3_384": "6324ff6f2bfc710a0dfcb59f0c2f991e0d68f81976b1e85777bb94827ec031a22720dd4b66b12e2576bde798b74a0645",
  "sha224": "d859465ac0ccfadba558b6a4856f9517f3ab15ac3b338a96a815af7e",
  "sha1": "44b7ed9daadb3ac89ead8977d04a0537fa3125ae",
  "sha3_512": "d3e927678ab6e0f6f00eba36f137565ba945d311f694a40fd8d1998296d41391e7ff9b07269499346ad65bc8f9f27d79b46680b1dc5656ad9e213491c2e1523a"
}